{
  "authorized_policies": [
    {
      "policy_sha256": "ffe78869bd31177cececfd793e99594b1da17b399045d1f3ca0e8a61d2e18dba",
      "policy_type": "dspy-security-bench-assurance-ledger-policy"
    }
  ],
  "expires_at": 1900000100,
  "issued_at": 1800000100,
  "keys": [
    {
      "entity_id": "vector-root-2",
      "keyid": "5aab46a79eedbb08f52ba775a198cc771da13500ab3bb2e56ba717a94488582b",
      "organization_id": "vector-root-organization-2",
      "public_key_spki_base64": "MCowBQYDK2VwAyEAi3lBqLpFNllDzJKbJkSwLWdkjzLJf5nxn82vpGfTttY=",
      "signature_scheme": "ed25519"
    },
    {
      "entity_id": "vector-root-1",
      "keyid": "b086889911b17e5a1486d0987cef6ea73942429470188590a78fabb1ab24b1ca",
      "organization_id": "vector-root-organization-1",
      "public_key_spki_base64": "MCowBQYDK2VwAyEABr56M2TDRFv3RNQVRU98fDVmhAQ/Tyn2fD5rkBEAXIs=",
      "signature_scheme": "ed25519"
    }
  ],
  "previous_root_sha256": "7dc6c73876558d1dc7bad38d60bb3a4adc587557ecffd0d79de58c6b7a943349",
  "previous_root_signatures": [
    {
      "keyid": "5aab46a79eedbb08f52ba775a198cc771da13500ab3bb2e56ba717a94488582b",
      "signature_base64": "jvFb99QFgTRXsLFnLQFbieDKu7HO8YNGIDT0eOHCzJDUietpxm09iGp8evPlVvzsghtin8Gj5Hk2GQCC5i0bBw==",
      "signature_scheme": "ed25519",
      "signer_id": "vector-root-2"
    },
    {
      "keyid": "b086889911b17e5a1486d0987cef6ea73942429470188590a78fabb1ab24b1ca",
      "signature_base64": "iVHh0upbgpdSqJqZSXZsw8tLQkET6MlXlRYjU3/5+kR8vP5AhUrQg0HCikY82vtUeYdN/T4w7hnwyl9/gNqEDQ==",
      "signature_scheme": "ed25519",
      "signer_id": "vector-root-1"
    }
  ],
  "protocol_version": "assuranceledger-trust-root-v1",
  "roles": {
    "ledger-observer": {
      "keyids": [
        "5aab46a79eedbb08f52ba775a198cc771da13500ab3bb2e56ba717a94488582b",
        "b086889911b17e5a1486d0987cef6ea73942429470188590a78fabb1ab24b1ca"
      ],
      "minimum_distinct_organizations": 1,
      "signature_threshold": 1
    },
    "ledger-operator": {
      "keyids": [
        "5aab46a79eedbb08f52ba775a198cc771da13500ab3bb2e56ba717a94488582b",
        "b086889911b17e5a1486d0987cef6ea73942429470188590a78fabb1ab24b1ca"
      ],
      "minimum_distinct_organizations": 1,
      "signature_threshold": 1
    },
    "ledger-witness": {
      "keyids": [
        "5aab46a79eedbb08f52ba775a198cc771da13500ab3bb2e56ba717a94488582b",
        "b086889911b17e5a1486d0987cef6ea73942429470188590a78fabb1ab24b1ca"
      ],
      "minimum_distinct_organizations": 1,
      "signature_threshold": 1
    },
    "quorum-reviewer": {
      "keyids": [
        "5aab46a79eedbb08f52ba775a198cc771da13500ab3bb2e56ba717a94488582b",
        "b086889911b17e5a1486d0987cef6ea73942429470188590a78fabb1ab24b1ca"
      ],
      "minimum_distinct_organizations": 1,
      "signature_threshold": 1
    },
    "root": {
      "keyids": [
        "5aab46a79eedbb08f52ba775a198cc771da13500ab3bb2e56ba717a94488582b",
        "b086889911b17e5a1486d0987cef6ea73942429470188590a78fabb1ab24b1ca"
      ],
      "minimum_distinct_organizations": 2,
      "signature_threshold": 2
    }
  },
  "root_sha256": "e2eea61f5e1d65adae67e53be4a7ce48482336e461cbaed5c6ec7c76d7b720db",
  "root_type": "dspy-security-bench-assurance-trust-root",
  "schema_version": 1,
  "signatures": [
    {
      "keyid": "5aab46a79eedbb08f52ba775a198cc771da13500ab3bb2e56ba717a94488582b",
      "signature_base64": "jvFb99QFgTRXsLFnLQFbieDKu7HO8YNGIDT0eOHCzJDUietpxm09iGp8evPlVvzsghtin8Gj5Hk2GQCC5i0bBw==",
      "signature_scheme": "ed25519",
      "signer_id": "vector-root-2"
    },
    {
      "keyid": "b086889911b17e5a1486d0987cef6ea73942429470188590a78fabb1ab24b1ca",
      "signature_base64": "iVHh0upbgpdSqJqZSXZsw8tLQkET6MlXlRYjU3/5+kR8vP5AhUrQg0HCikY82vtUeYdN/T4w7hnwyl9/gNqEDQ==",
      "signature_scheme": "ed25519",
      "signer_id": "vector-root-1"
    }
  ],
  "trust_domain": "root-view-vector.example/assurance",
  "version": 2
}
